id,accessPointType,pickupEnabled,lastChange,name,capacityStatus,latitude,longitude
4441737,AlzaBox,False,2025-04-28T21:20:47.25,ABOX HVV Šrámkova (Hruška),Unknown,49.77161,18.455883
4441743,AlzaBox,False,2025-04-28T21:20:47.45,ABOX BRN Dornych (Lidl),Unknown,49.186516,16.621294
4441746,AlzaBox,False,2025-04-28T21:20:47.647,ABOX ZEB Tovární (Coop),Unknown,49.872715,13.894212
4441748,AlzaBox,False,2025-04-28T21:20:47.713,ABOX MTB Lanškrounská (Kubík),Unknown,49.75999,16.6646
4441749,AlzaBox,False,2025-04-28T21:20:47.753,ABOX ABOX CKN Čkyně,Unknown,49.114958611,13.825537805
4441753,AlzaBox,False,2025-04-28T21:20:47.893,ABOX BNA Nábřeží (Pepco),Unknown,50.5537,13.772638
4441755,AlzaBox,False,2025-04-28T21:20:47.987,ABOX PRG Pertoldova,Unknown,50.00024,14.427118
4441756,AlzaBox,False,2025-04-28T21:20:48.027,ABOX PRG Vodičkova (Myšák),Unknown,50.08145,14.423924
4441760,AlzaBox,False,2025-04-28T21:20:48.14,ABOX TMV Tlumačov (ČS PRIM),Unknown,49.261467,17.495476
4441761,AlzaBox,False,2025-04-28T21:20:48.197,ABOX NCE Hlavní (ČS PRIM),Unknown,49.993458,17.812998
4441762,AlzaBox,False,2025-04-28T21:20:48.217,ABOX LNL Jedličkova (ČS PRIM),Unknown,50.199867,14.846348
4441766,AlzaBox,False,2025-04-28T21:20:48.627,ABOX STK Smetanova (Coop),Unknown,49.265877,13.904096
4441767,AlzaBox,False,2025-04-28T21:20:48.63,ABOX JIH Na Dolech (Penny),Unknown,49.409424,15.567814
4441768,AlzaBox,False,2025-04-28T21:20:48.693,ABOX HTO nám. května,Unknown,49.10851,16.057446
4441772,AlzaBox,False,2025-04-28T21:20:48.84,ABOX MEN Měnín (Pekárna),Unknown,49.08069,16.693289
4441775,AlzaBox,False,2025-04-28T21:20:48.957,ABOX BRM Družba (Papírnic),Unknown,49.08447,18.022629
4441778,AlzaBox,False,2025-04-28T21:20:49.057,ABOX BRY Břasy (Coop),Unknown,49.832897,13.585553
4441779,AlzaBox,False,2025-04-28T21:20:49.093,ABOX SPV Dolní,Unknown,49.681877,17.223665
4441780,AlzaBox,False,2025-04-28T21:20:49.103,ABOX BDS Slánská,Unknown,50.189,14.1608
4441787,AlzaBox,False,2025-04-28T21:20:49.323,ABOX PRG Vyšehradská,Unknown,50.068096,14.416715
4441798,AlzaBox,False,2025-04-28T21:20:49.603,ABOX PRG Tomíčkova (T-Mobile),Unknown,50.03887,14.476927
4441801,AlzaBox,False,2025-04-28T21:20:49.697,ABOX PRG V Lipách,Unknown,50.061714,14.641434
4441802,AlzaBox,False,2025-04-28T21:20:49.727,ABOX SEV Nová,Unknown,49.254105,14.718674
4441805,AlzaBox,False,2025-04-28T21:20:49.793,ABOX RDV Na Plácku (Parkoviš),Unknown,48.992275,14.535645
4441809,AlzaBox,False,2025-04-28T21:20:49.903,ABOX UJA Komenského,Unknown,49.881966,15.061164
4441810,AlzaBox,False,2025-04-28T21:20:49.957,ABOX PRG Babákova,Unknown,50.03625,14.48746
4441813,AlzaBox,False,2025-04-28T21:20:50.113,ABOX ODV Dolní náměstí (Eso),Unknown,50.233498,14.410106
4441814,AlzaBox,False,2025-04-28T21:20:50.177,ABOX LGE Markvartovická (Tuty),Unknown,49.891098,18.240164
4441815,AlzaBox,False,2025-04-28T21:20:50.223,ABOX ONV Lhotská (Coop),Unknown,49.00448,17.435612
4441816,AlzaBox,False,2025-04-28T21:20:50.257,ABOX PRG Za Pískovnou,Unknown,50.13967,14.450196
4441818,AlzaBox,False,2025-04-28T21:20:50.387,ABOX PRG U Nákl. nádraží,Unknown,50.084717,14.481601
4441819,AlzaBox,False,2025-04-28T21:20:50.447,ABOX VLY Školní (Coop),Unknown,50.281593,14.23833
4441820,AlzaBox,False,2025-04-28T21:20:50.48,ABOX PRG Zenklova (KB),Unknown,50.103104,14.47412
4441821,AlzaBox,False,2025-04-28T21:20:50.507,ABOX PRG Českobrodská,Unknown,50.08122,14.610599
4441825,AlzaBox,False,2025-04-28T21:20:50.583,ABOX RAS Raškovice (Coop),Unknown,49.61081,18.485043
4441826,AlzaBox,False,2025-04-28T21:20:50.643,ABOX PRG Kazínská,Unknown,50.012028,14.385739
4441832,AlzaBox,False,2025-04-28T21:20:50.863,ABOX POS Teplická (Motorest),Unknown,50.23261,14.387867
4441833,AlzaBox,False,2025-04-28T21:20:50.91,ABOX PRG K Třebonicům (Penziony),Unknown,50.035362,14.305451
4441834,AlzaBox,False,2025-04-28T21:20:50.94,ABOX VAL Za Radnicí (nádraží),Unknown,48.74241,16.75572
4441835,AlzaBox,False,2025-04-28T21:20:50.983,ABOX FDM Ostravská,Unknown,49.6739,18.339825
4441837,AlzaBox,False,2025-04-28T21:20:51.023,ABOX NAV Návsí (Coop),Unknown,49.58664,18.759584
4441841,AlzaBox,False,2025-04-28T21:20:51.183,ABOX ZAH 28. října (Billa),Unknown,49.88053,16.875221
4441842,AlzaBox,False,2025-04-28T21:20:51.22,ABOX BNL Pražská,Unknown,50.178024,14.653498
4441845,AlzaBox,False,2025-04-28T21:20:51.3,ABOX MLK Klášterní (Kaufland),Unknown,50.35839,14.47546
4441846,AlzaBox,False,2025-04-28T21:20:51.357,ABOX PRG Kolbenova (Kaufland),Unknown,50.108997,14.544511
4441847,AlzaBox,False,2025-04-28T21:20:51.393,ABOX NBR B. Egermanna (Kaufland),Unknown,50.76631,14.544685
4441849,AlzaBox,False,2025-04-28T21:20:51.467,ABOX CBE Na Sádkách (Kaufland),Unknown,48.973953,14.463697
4441850,AlzaBox,False,2025-04-28T21:20:51.497,ABOX JIL Pražská,Unknown,49.926575,14.34137
4441855,AlzaBox,False,2025-04-28T21:20:51.663,ABOX LNS Pivovarská (Coop),Unknown,49.69803,15.281007
4441856,AlzaBox,False,2025-04-28T21:20:51.697,ABOX TBR 9. května (Dvořák),Unknown,49.41256,14.671344
4441857,AlzaBox,False,2025-04-28T21:20:51.733,ABOX PCE Kyjevská (Lékárna),Unknown,50.02909,15.790565
4441858,AlzaBox,False,2025-04-28T21:20:51.74,ABOX PRG Osinalická,Unknown,50.145233,14.48282
4441859,AlzaBox,False,2025-04-28T21:20:51.793,ABOX LBN Přemyslova (zastávka),Unknown,50.16909,14.056826
4441860,AlzaBox,False,2025-04-28T21:20:51.83,ABOX KOL Benešova (Kaufland),Unknown,50.021465,15.184642
4441862,AlzaBox,False,2025-04-28T21:20:51.89,ABOX JBN U Kostela (Kaufland),Unknown,50.739014,15.168783
4441863,AlzaBox,False,2025-04-28T21:20:51.943,ABOX TRU Horská (Kaufland),Unknown,50.58328,15.890543
4441864,AlzaBox,False,2025-04-28T21:20:51.973,ABOX KTH Ortenova (Kaufland),Unknown,49.96098,15.283389
4441869,AlzaBox,False,2025-04-28T21:20:52.137,ABOX HAN Hlavní (Penny),Unknown,50.076454,16.93169
4441870,AlzaBox,False,2025-04-28T21:20:52.203,ABOX LAN Husova (Penny),Unknown,49.909344,16.611233
4441872,AlzaBox,False,2025-04-28T21:20:52.27,ABOX PLA Hegerova (Penny),Unknown,49.718575,16.27636
4441874,AlzaBox,False,2025-04-28T21:20:52.34,ABOX LNP Pivovarská (Penny),Unknown,50.532875,15.370529
4441875,AlzaBox,False,2025-04-28T21:20:52.35,ABOX PBY Dukelská (Penny),Unknown,50.22937,13.40915
4441878,AlzaBox,False,2025-04-28T21:20:52.5,ABOX HBD U Cihláře (Penny),Unknown,49.618153,15.575457
4441880,AlzaBox,False,2025-04-28T21:20:52.567,ABOX PRG Na Slupi (Lidl),Unknown,50.066307,14.422695
4454178,AlzaBox,False,2025-04-28T21:20:52.643,ABOX MTB Svitavská (Kaufland),Unknown,49.75645,16.645369
4454179,AlzaBox,False,2025-04-28T21:20:52.697,ABOX PRG Podolské nábř. (Parkoviš),Unknown,50.06118,14.419069
4454181,AlzaBox,False,2025-04-28T21:20:52.763,ABOX UVL Škvorecká (Billa),Unknown,50.06703,14.736226
4454183,AlzaBox,False,2025-04-28T21:20:52.823,ABOX HDO Brunšov,Unknown,49.856754,14.402051
4454184,AlzaBox,False,2025-04-28T21:20:52.833,ABOX JBN Jitřní (CBA),Unknown,50.727623,15.182363
4454187,AlzaBox,False,2025-04-28T21:20:52.957,ABOX RLE Náměstí (Coop),Unknown,50.303207,15.169319
4454191,AlzaBox,False,2025-04-28T21:20:53.083,ABOX KSL 9. května (Coop),Unknown,50.184505,14.961227
4454193,AlzaBox,False,2025-04-28T21:20:53.173,ABOX PRG Vinohradská (Vinice),Unknown,50.07737,14.487615
4454194,AlzaBox,False,2025-04-28T21:20:53.213,ABOX LTV Valdštejnská (OD Máj),Unknown,50.603878,13.609757
4454196,AlzaBox,False,2025-04-28T21:20:53.28,ABOX PRG Trojská (Pošta),Unknown,50.11676,14.421874
4454198,AlzaBox,False,2025-04-28T21:20:53.347,ABOX HCN Opavská a (Billa),Unknown,49.89867,18.183365
4454201,AlzaBox,False,2025-04-28T21:20:53.457,ABOX KRM Ruská (Parkoviš),Unknown,49.997765,14.97142
4454203,AlzaBox,False,2025-04-28T21:20:53.523,ABOX OLO Wolkerova (Flora),Unknown,49.587894,17.24562
4454204,AlzaBox,False,2025-04-28T21:20:53.553,ABOX PRG Cafourkova,Unknown,50.13185,14.410665
4454209,AlzaBox,False,2025-04-28T21:20:54.237,ABOX UNL Okružní (Kaufland),Unknown,50.66301,14.020929
4454210,AlzaBox,False,2025-04-28T21:20:54.24,ABOX ZNM Dukel.bojovníků (Kaufland),Unknown,48.837154,16.064688
4454211,AlzaBox,False,2025-04-28T21:20:54.31,ABOX CHR SNP (Kaufland),Unknown,49.947803,15.810283
4454214,AlzaBox,False,2025-04-28T21:20:54.417,ABOX BON Obchodní (Kaufland),Unknown,49.956795,14.060374
4454217,AlzaBox,False,2025-04-28T21:20:54.513,ABOX MST Kabátnická (Kaufland),Unknown,50.512432,13.64649
4454219,AlzaBox,False,2025-04-28T21:20:54.577,ABOX OLO Štursova (Kaufland),Unknown,49.588573,17.272503
4454221,AlzaBox,False,2025-04-28T21:20:54.653,ABOX SNK Průmyslová (Kaufland),Unknown,49.71226,17.291561
4454223,AlzaBox,False,2025-04-28T21:20:54.723,ABOX HPC Okružní (Kaufland),Unknown,49.53899,15.345486
4454228,AlzaBox,False,2025-04-28T21:20:54.88,ABOX JBN Jateční (Kaufland),Unknown,50.715694,15.157923
4454230,AlzaBox,False,2025-04-28T21:20:54.953,ABOX UNL Všebořická (Kaufland),Unknown,50.68442,13.994398
4454231,AlzaBox,False,2025-04-28T21:20:54.963,ABOX ZTC Kadaňská (Kaufland),Unknown,50.323723,13.528524
4454232,AlzaBox,False,2025-04-28T21:20:55.02,ABOX KVA Sokolovská (Kaufland),Unknown,50.23309,12.8415
4454233,AlzaBox,False,2025-04-28T21:20:55.057,ABOX NAC Polská (Kaufland),Unknown,50.424164,16.1914
4454234,AlzaBox,False,2025-04-28T21:20:55.09,ABOX BOS Rovná (Kaufland),Unknown,49.490925,16.641214
4454235,AlzaBox,False,2025-04-28T21:20:55.133,ABOX KJV Svatoborská (Kaufland),Unknown,49.00457,17.108147
4454236,AlzaBox,False,2025-04-28T21:20:55.27,ABOX BRN Kamenice (Kaufland),Unknown,49.17428,16.582314
4454239,AlzaBox,False,2025-04-28T21:20:55.54,ABOX HVV Před Tratí (Kaufland),Unknown,49.78798,18.44191
4454240,AlzaBox,False,2025-04-28T21:20:55.583,ABOX OPV Olomoucká (Kaufland),Unknown,49.93055,17.874216
4454248,AlzaBox,False,2025-04-28T21:20:55.967,ABOX RPR Meziříčská (Kaufland),Unknown,49.459095,18.132736
4454250,AlzaBox,False,2025-04-28T21:20:56.04,ABOX MHE Družstevní (Kaufland),Unknown,49.775215,16.933634
4454251,AlzaBox,False,2025-04-28T21:20:56.043,ABOX PSV Okružní (Kaufland),Unknown,49.463028,17.117622
4454252,AlzaBox,False,2025-04-28T21:20:56.113,ABOX VEM U Tržiště (Kaufland),Unknown,49.348396,16.023844
4454253,AlzaBox,False,2025-04-28T21:20:56.147,ABOX ZNS Chelčického (Kaufland),Unknown,49.554974,15.937442
4454256,AlzaBox,False,2025-04-28T21:20:56.25,ABOX HKR Pilnáčkova (Kaufland),Unknown,50.21718,15.839553
4454258,AlzaBox,False,2025-04-28T21:20:56.293,ABOX CHM Mostecká (Kaufland),Unknown,50.464626,13.42121
4454260,AlzaBox,False,2025-04-28T21:20:56.38,ABOX VNF Čs. mládeže (Kaufland),Unknown,50.913445,14.612148
4454261,AlzaBox,False,2025-04-28T21:20:56.427,ABOX LKN Dvořákova (Kaufland),Unknown,49.911114,16.60203
4454262,AlzaBox,False,2025-04-28T21:20:56.447,ABOX PLZ Lochotínská (Kaufland),Unknown,49.75232,13.37767
4454263,AlzaBox,False,2025-04-28T21:20:56.507,ABOX BEN Červené Vršky (Kaufland),Unknown,49.793686,14.682444
4454265,AlzaBox,False,2025-04-28T21:20:56.563,ABOX KLA Štěpánská (Coop),Unknown,50.14197,14.111418
4454268,AlzaBox,False,2025-04-28T21:20:56.683,ABOX POD U Garáží (Kaufland),Unknown,50.15297,15.117866
4454271,AlzaBox,False,2025-04-28T21:20:56.76,ABOX BRN Ve Vaňkovce (Vaňkovka),Unknown,49.186874,16.615067
4454274,AlzaBox,False,2025-04-28T21:20:56.86,ABOX PRG Svatoplukova (MOL),Unknown,50.065865,14.430597
4454275,AlzaBox,False,2025-04-28T21:20:56.917,ABOX PRG Olbrachtova (MOL),Unknown,50.043503,14.440189
4454277,AlzaBox,False,2025-04-28T21:20:56.973,ABOX PRG Partyzánská (Port7),Unknown,50.11097,14.438718
4454281,AlzaBox,False,2025-04-28T21:20:57.137,ABOX PRG Pod Paťankou (Kaufland),Unknown,50.11137,14.393352
4454284,AlzaBox,False,2025-04-28T21:20:57.237,ABOX OST Masarykovo nám. (OC Laso),Unknown,49.83687,18.292671
4454291,AlzaBox,False,2025-04-28T21:20:57.47,ABOX VPP Jesenická (Penny),Unknown,50.121437,17.381226
4454292,AlzaBox,False,2025-04-28T21:20:57.503,ABOX PRG Slovenská (Bohemian),Unknown,50.072624,14.447825
4454298,AlzaBox,False,2025-04-28T21:20:57.68,ABOX JRY Luční (AZSTINEN),Unknown,50.110584,14.702641
4454301,AlzaBox,False,2025-04-28T21:20:57.82,ABOX KLA nám.J.Masaryka (OD),Unknown,50.139668,14.072554
4454302,AlzaBox,False,2025-04-28T21:20:57.847,ABOX LIE sady Pionýrů (Potravin),Unknown,49.694145,13.256049
4454303,AlzaBox,False,2025-04-28T21:20:57.883,ABOX DJE Jesenická,Unknown,49.97809,14.570219
4454304,AlzaBox,False,2025-04-28T21:20:57.913,ABOX DHE Palackého (Coop),Unknown,49.927486,14.274749
4454305,AlzaBox,False,2025-04-28T21:20:57.957,ABOX CVE Čisovice (Úřad),Unknown,49.863293,14.315409
4454306,AlzaBox,False,2025-04-28T21:20:57.987,ABOX DRS Dřísy (Potravin),Unknown,50.255695,14.643479
4454307,AlzaBox,False,2025-04-28T21:20:58.02,ABOX HUY Baumanova (Walter),Unknown,50.106438,14.741438
4454312,AlzaBox,False,2025-04-28T21:20:58.207,ABOX PRG Železničářů,Unknown,50.107445,14.441621
4454313,AlzaBox,False,2025-04-28T21:20:58.247,ABOX JSE Říčanská (Lékařský),Unknown,49.96911,14.528866
4454315,AlzaBox,False,2025-04-28T21:20:58.293,ABOX DEC Plzeňská (OC Korál),Unknown,50.772865,14.199496
4454318,AlzaBox,False,2025-04-28T21:20:58.427,ABOX TRV Sobotecká (Parkoviš),Unknown,50.585945,15.154406
4454321,AlzaBox,False,2025-04-28T21:20:58.48,ABOX KNE Kunice (Flop),Unknown,49.93649,14.668844
4454324,AlzaBox,False,2025-04-28T21:20:58.593,ABOX NCE Tyršova,Unknown,50.015682,14.22368
4454325,AlzaBox,False,2025-04-28T21:20:58.63,ABOX LNE Obecní (Potravin),Unknown,49.982536,14.760543
4454326,AlzaBox,False,2025-04-28T21:20:58.657,ABOX HBD Strojírenská (Retail),Unknown,49.604626,15.602107
4454327,AlzaBox,False,2025-04-28T21:20:58.693,ABOX PRG Krausova (Pizza),Unknown,50.141006,14.507617
4454328,AlzaBox,False,2025-04-28T21:20:58.73,ABOX CLP Havířská (Market),Unknown,50.695587,14.539229
4454332,AlzaBox,False,2025-04-28T21:20:58.877,ABOX PRG Za Zahradou (Koleje),Unknown,50.08796,14.353055
4454333,AlzaBox,False,2025-04-28T21:20:58.88,ABOX BRN nám. Karla IV. (Coop),Unknown,49.20663,16.69483
4454335,AlzaBox,False,2025-04-28T21:20:58.977,ABOX KRE Ke Dvoru (Parkoviš),Unknown,50.03199,14.668938
4454336,AlzaBox,False,2025-04-28T21:20:59.01,ABOX KNV Nám.J.Seiferta,Unknown,50.247173,14.317177
4454341,AlzaBox,False,2025-04-28T21:20:59.203,ABOX JLV Teplická (Koupališ),Unknown,50.761467,14.106635
4454342,AlzaBox,False,2025-04-28T21:20:59.237,ABOX Slezská Ostrava - Kunčičky (Pošta),Unknown,49.808037,18.295013
4454344,AlzaBox,False,2025-04-28T21:20:59.537,ABOX VLN Hlavní (Norman),Unknown,50.175285,14.557178
4454345,AlzaBox,False,2025-04-28T21:20:59.607,ABOX RCY Černokostelecká (Lékárna),Unknown,49.99945,14.667299
4454346,AlzaBox,False,2025-04-28T21:20:59.633,ABOX HBC nám. Draha (Coop),Unknown,50.136208,14.16425
4454350,AlzaBox,False,2025-04-28T21:20:59.75,ABOX PNL Zákostelní (Úřad),Unknown,49.350986,14.703974
4454356,AlzaBox,False,2025-04-28T21:20:59.987,ABOX NYB B. Egermanna,Unknown,50.76266,14.550627
4454358,AlzaBox,False,2025-04-28T21:21:00.107,ABOX HPE Brněnská (Kaufland),Unknown,48.951534,16.724295
4454360,AlzaBox,False,2025-04-28T21:21:00.227,ABOX HSO Horní Slivno (Úřad),Unknown,50.30407,14.708129
4454362,AlzaBox,False,2025-04-28T21:21:00.297,ABOX CYE Hlavní (úřad),Unknown,50.06123,14.225501
4454364,AlzaBox,False,2025-04-28T21:21:00.37,ABOX KZY Kostelecká (ČS),Unknown,49.99232,14.818992
4454366,AlzaBox,False,2025-04-28T21:21:00.453,ABOX MLB tř.V.Klementa (Bondy),Unknown,50.41974,14.915733
4454368,AlzaBox,False,2025-04-30T16:46:15.187,ABOX VPE Masarykova (Parkoviš),Unknown,49.921658,14.644055
4454370,AlzaBox,False,2025-04-28T21:21:00.59,ABOX OLO tř. Svornosti (ODTimpo),Unknown,49.593155,17.228657
4454371,AlzaBox,False,2025-04-28T21:21:00.617,ABOX JSE Pražská (Na Kocan),Unknown,49.97122,14.541776
4454375,AlzaBox,False,2025-04-28T21:21:01.203,ABOX PSY Na Návsi (Potravin),Unknown,49.936314,14.512636
4473536,AlzaBox,False,2025-04-28T21:21:01.28,ABOX CKY Kojetická (Úřad),Unknown,50.229355,14.531145
4473538,AlzaBox,False,2025-04-28T21:21:01.393,ABOX PRG Novosibřinská,Unknown,50.074097,14.67125
4473540,AlzaBox,False,2025-04-28T21:21:01.46,ABOX LTV Podkrušnohorská,Unknown,50.608246,13.626066999999999
4473541,AlzaBox,False,2025-04-28T21:21:01.497,ABOX SHV Mnichovická (Enapo),Unknown,49.955753,14.748731
4473542,AlzaBox,False,2025-04-28T21:21:01.537,ABOX ZNM Vídeňská tř. (Světla),Unknown,48.84721,16.056648
4473547,AlzaBox,False,2025-04-28T21:21:01.747,ABOX TNS K Lesíku,Unknown,49.838108,14.580811
4473548,AlzaBox,False,2025-04-28T21:21:01.813,ABOX LNV Lipno n.Vltavou (Medical),Unknown,48.638878,14.226073
4473550,AlzaBox,False,2025-04-28T21:21:01.897,ABOX TMA Plzeňská (OC),Unknown,49.81557,13.395125
4473553,AlzaBox,False,2025-04-28T21:21:01.973,ABOX DZY Ke Zvoli (NaHřišti),Unknown,49.962242,14.452397
4473554,AlzaBox,False,2025-04-28T21:21:02.03,ABOX LTS Za Školou,Unknown,50.169174,14.71547
4473557,AlzaBox,False,2025-04-28T21:21:02.133,ABOX TBR nám. F. Křižíka (Fio),Unknown,49.412567,14.66469
4473560,AlzaBox,False,2025-04-28T21:21:02.24,ABOX KLY Palackého (Móda),Unknown,49.397385,13.297198
4473565,AlzaBox,False,2025-04-28T21:21:02.41,ABOX CUD Unhošťská (Žabka),Unknown,50.068565,14.165651
4473566,AlzaBox,False,2025-04-28T21:21:02.44,ABOX TAE Jakubská náves (Úřad),Unknown,50.010887,14.2445
4473567,AlzaBox,False,2025-04-28T21:21:02.48,ABOX STC Statenická (Potravin),Unknown,50.14164,14.318586
4493129,AlzaBox,False,2025-04-28T21:21:02.957,ABOX PRG Josefa Houdka (Retail),Unknown,49.963768,14.363903
4493133,AlzaBox,False,2025-04-28T21:21:03.073,ABOX MIL Dukelská (Potravin),Unknown,50.230385,14.886291
4493136,AlzaBox,False,2025-04-28T21:21:03.197,ABOX LBC Pernštýnská (Potravin),Unknown,50.07552,15.679935
4493138,AlzaBox,False,2025-04-28T21:21:03.267,ABOX BBE Ke Hřišti,Unknown,50.01121,14.718402
4493139,AlzaBox,False,2025-04-28T21:21:03.317,ABOX PRG Hrazanská,Unknown,49.987694,14.445213
4493141,AlzaBox,False,2025-04-28T21:21:03.357,ABOX SJE Tyršova,Unknown,50.105705,14.681647
4493147,AlzaBox,False,2025-04-28T21:21:03.593,ABOX PRG Karlovarská (OMV),Unknown,50.075665,14.313104
4493148,AlzaBox,False,2025-04-28T21:21:03.627,ABOX CRY Nad Jezem,Unknown,49.858234,14.699422
4493149,AlzaBox,False,2025-04-28T21:21:03.667,ABOX MAN Kostelecká (CS POINT),Unknown,50.200607,14.546309
4493150,AlzaBox,False,2025-04-28T21:21:03.827,ABOX BRN Technická,Unknown,49.22495,16.576986
4493152,AlzaBox,False,2025-04-28T21:21:03.87,ABOX KCY Hlavní (Restaura),Unknown,50.202225,14.433773
4493154,AlzaBox,False,2025-04-28T21:21:03.937,ABOX NLS Kralupská (Potravin),Unknown,50.261,14.298842
4493155,AlzaBox,False,2025-04-28T21:21:04,ABOX CRE Nám. 9. května (ZOOshopi),Unknown,50.672604,13.94502
4493160,AlzaBox,False,2025-04-28T21:21:04.123,ABOX CLP 28. října (LEVNO),Unknown,50.69159,14.547698
4493161,AlzaBox,False,2025-04-28T21:21:04.16,ABOX SEO Slánská (Tabák),Unknown,50.188805,14.043409
4493163,AlzaBox,False,2025-04-28T21:21:04.263,ABOX PRG Malkovského,Unknown,50.14191,14.510346
4493164,AlzaBox,False,2025-04-28T21:21:04.317,ABOX PRG Vašátkova (Potravin),Unknown,50.102024,14.566901
4493165,AlzaBox,False,2025-04-28T21:21:04.347,ABOX KMP Kamenný Přívoz (úřad),Unknown,49.860825,14.503413
4493167,AlzaBox,False,2025-04-28T21:21:04.41,ABOX BRN Košuličova,Unknown,49.165257,16.612528
4493169,AlzaBox,False,2025-04-28T21:21:04.483,ABOX BRN Kabátníkova (OC Sfinx),Unknown,49.2108,16.600466
4493171,AlzaBox,False,2025-04-28T21:21:04.59,ABOX PRG Ke Kateřinkám (IceAréna),Unknown,50.022446,14.518008
4493172,AlzaBox,False,2025-04-28T21:21:04.85,ABOX PRG Ostrovského (Akcent),Unknown,50.06874,14.402121
4493173,AlzaBox,False,2025-04-28T21:21:05.087,ABOX PRG Pod Lysinami,Unknown,50.02196,14.413921
4493176,AlzaBox,False,2025-04-28T21:21:05.23,ABOX JNO Hradisková,Unknown,50.029144,16.603928
4493177,AlzaBox,False,2025-04-28T21:21:05.24,ABOX LHE Lochovice (Coop),Unknown,49.849995,13.976804
4493178,AlzaBox,False,2025-04-28T21:21:05.293,ABOX PRG Kurčatovova,Unknown,50.03277,14.563867
4493179,AlzaBox,False,2025-04-28T21:21:05.33,ABOX PRG Sokolovská (Futurama),Unknown,50.096706,14.462987
4493184,AlzaBox,False,2025-04-28T21:21:05.497,ABOX BRN Špitálka,Unknown,49.19564,16.623762
4493185,AlzaBox,False,2025-04-28T21:21:05.53,ABOX PRG Sazečská (Valeo),Unknown,50.07604,14.519142
4493188,AlzaBox,False,2025-04-28T21:21:05.633,ABOX PBY Hlavní (Úřad),Unknown,50.214035,14.441035
4493191,AlzaBox,False,2025-04-28T21:21:05.747,ABOX TRV Průmyslová (Retail),Unknown,50.595505,15.132452
4493194,AlzaBox,False,2025-04-28T21:21:05.833,ABOX CME Čimelice (Coop),Unknown,49.465134,14.069112
4493197,AlzaBox,False,2025-04-28T21:21:05.96,ABOX SBA Říčanská (Ledocom),Unknown,50.056046,14.669715
4493198,AlzaBox,False,2025-04-28T21:21:06.003,ABOX SKA Předměstská (pošta),Unknown,50.46824,15.178926
4493199,AlzaBox,False,2025-04-28T21:21:06.037,ABOX PRG Pod Marjánkou,Unknown,50.0844,14.371312
4493201,AlzaBox,False,2025-04-28T21:21:06.117,ABOX VOY Průběžná,Unknown,50.2019,14.406257
4493202,AlzaBox,False,2025-04-28T21:21:06.147,ABOX VUK Hlavní,Unknown,50.171604,14.089236
4493203,AlzaBox,False,2025-04-28T21:21:06.153,ABOX PRG Na Hlavní,Unknown,50.165073,14.484582
4493204,AlzaBox,False,2025-04-28T21:21:06.217,ABOX PRG Šrobárova,Unknown,50.076206,14.475637
4493206,AlzaBox,False,2025-04-28T21:21:06.29,ABOX TSV Čemínská (Autobus),Unknown,49.776196,13.25148
4493208,AlzaBox,False,2025-04-28T21:21:06.407,ABOX SEN nám.Š.Lomnickéh (Úřad),Unknown,49.09945,14.57202
4493209,AlzaBox,False,2025-04-28T21:21:06.437,ABOX KVA Bezručova (Nemocnic),Unknown,50.232586,12.876426
4493210,AlzaBox,False,2025-04-28T21:21:06.447,ABOX KMY Průmyslová (Parkoviš),Unknown,50.4287,14.935555
4505574,AlzaBox,False,2025-04-28T21:21:06.577,ABOX PRG Na Větrníku,Unknown,50.08888,14.352032
4505577,AlzaBox,False,2025-04-28T21:21:06.683,ABOX PRG Ohnivcova,Unknown,50.025833,14.426241
4505579,AlzaBox,False,2025-04-28T21:21:06.757,ABOX DBV Náměstí T. G. Masaryka (Coop),Unknown,50.439045,15.126818
4505581,AlzaBox,False,2025-04-28T21:21:06.83,ABOX STK Bezděkovská (OC Maxim),Unknown,49.257565,13.905191
4505582,AlzaBox,False,2025-04-28T21:21:06.873,ABOX DBO nám. Jiráskovo (Trefa),Unknown,49.17025,14.581011
4505583,AlzaBox,False,2025-04-28T21:21:06.907,ABOX DEC Řetězová (Parkoviš),Unknown,50.780758,14.212137
4505585,AlzaBox,False,2025-04-28T21:21:06.95,ABOX STC Kralupská (Ložiska),Unknown,50.148743,14.32789
4505586,AlzaBox,False,2025-04-28T21:21:07.013,ABOX HUB Palackého,Unknown,49.0365,16.593323
4505589,AlzaBox,False,2025-04-28T21:21:07.127,ABOX MIE Masarykovo nám. (Coop),Unknown,49.51557,14.035207
4505590,AlzaBox,False,2025-04-28T21:21:07.157,ABOX PLZ Chebská (Zastávka),Unknown,49.75602,13.306394
4505594,AlzaBox,False,2025-04-28T21:21:07.3,ABOX TRU Palackého (Poliklin),Unknown,50.559788,15.909084
4505596,AlzaBox,False,2025-04-28T21:21:07.357,ABOX JIH Havlíčkova (DKO),Unknown,49.40057,15.587934
4505598,AlzaBox,False,2025-04-28T21:21:07.443,ABOX HSN Hájecká (Coop),Unknown,50.11233,14.20093
4505602,AlzaBox,False,2025-04-28T21:21:07.56,ABOX KSR Jablonského tř.,Unknown,49.184628,14.85192
4505603,AlzaBox,False,2025-04-28T21:21:07.623,ABOX BRN Lazaretní,Unknown,49.203846944,16.633255944
4505604,AlzaBox,False,2025-04-28T21:21:07.657,ABOX VPC Hlavní (Pošta),Unknown,48.904808,16.818296
4505607,AlzaBox,False,2025-04-28T21:21:07.803,ABOX PPY Náves (úřad),Unknown,49.17832,16.488768
4505608,AlzaBox,False,2025-04-28T21:21:07.837,ABOX BRN Wainerovo nám.,Unknown,49.177055,16.641048
4505609,AlzaBox,False,2025-04-28T21:21:07.897,ABOX BRN Foltýnova (Průkopní),Unknown,49.21704,16.508991
4505614,AlzaBox,False,2025-04-28T21:21:08.083,ABOX OVA K Šálku (Nádraží),Unknown,50.223812,14.416788
4505619,AlzaBox,False,2025-04-28T21:21:08.247,ABOX PCE 17. listopadu (Parkoviš),Unknown,50.03261,15.77006
4505620,AlzaBox,False,2025-04-28T21:21:08.29,ABOX NBC Žižkova (Lékařský),Unknown,49.020023,15.099658
4505621,AlzaBox,False,2025-04-28T21:21:08.327,ABOX BLA Okružní,Unknown,49.372913,16.650284
4505622,AlzaBox,False,2025-04-28T21:21:08.337,ABOX NOE Vrchoslavská (AutoKlik),Unknown,50.660114,13.823466
4505624,AlzaBox,False,2025-04-28T21:21:08.423,ABOX THV Mánesova (Billa),Unknown,49.798843,12.634635
4505625,AlzaBox,False,2025-04-28T21:21:08.457,ABOX CTN Ostravská,Unknown,49.74599,18.61794
4505627,AlzaBox,False,2025-04-28T21:21:08.543,ABOX PRG Schoellerova,Unknown,50.157166,14.522694
4505630,AlzaBox,False,2025-04-28T21:21:08.643,ABOX ZAE Městečko (Potravin),Unknown,49.065697,17.028976
4505631,AlzaBox,False,2025-04-28T21:21:08.677,ABOX PRG Za Vodárnou (Mazanka),Unknown,50.12375,14.473676
4505633,AlzaBox,False,2025-04-28T21:21:08.747,ABOX SCE Hlavní (MŠ),Unknown,49.850544,14.406664
4505634,AlzaBox,False,2025-04-28T21:21:08.757,ABOX SVC Masarykovo nám.,Unknown,50.04531,14.72923
4505635,AlzaBox,False,2025-04-28T21:21:08.827,ABOX BST Hlavní (Potravin),Unknown,50.204086,14.468536
4505636,AlzaBox,False,2025-04-28T21:21:08.857,ABOX FDM Frýdlantská (Lidl),Unknown,49.666874,18.349148
4505638,AlzaBox,False,2025-04-28T21:21:08.927,ABOX BRN Dobrovského,Unknown,49.219395,16.592995
4505640,AlzaBox,False,2025-04-28T21:21:08.99,ABOX FLK Bílovecká (Retail),Unknown,49.716633,17.914282
4505644,AlzaBox,False,2025-04-28T21:21:09.147,ABOX PRG Saratovská,Unknown,50.073654,14.492919
4505649,AlzaBox,False,2025-04-28T21:21:09.333,ABOX CHB Matěje Kopeckého (Potravin),Unknown,50.06534,12.371
4505650,AlzaBox,False,2025-04-28T21:21:09.37,ABOX PRG Cílkova,Unknown,50.015026,14.443463
4505653,AlzaBox,False,2025-04-28T21:21:09.48,ABOX PRG Mladoboleslavská (LevnePne),Unknown,50.130394,14.54909
